"","Indicator","Indicator_Id","Indicator_Name","answer","Display_Name","Dataset","Value_Type_Slug","Value_Type_Descriptor","Units","Rank_1","Category_11","Category_12","Category_13","Category_14","Category_15","Rank_2","Category_21","Category_22","Category_23","Category_24","Category_25","Rank_3","Category_31","Category_32","Category_33","Category_34","Indicator.Code","Indicator.ID","overlap","Indicator_Code","Description"
"1","are employers required to provide break time for nursing mothers?-WBL-1 Yes 0 No","54-WBL-Total","Are employers required to provide break time for nursing mothers?","Total","Are employers required to provide break time for nursing mothers?","WBL",NA,NA,NA,NA,NA,NA,NA,NA,NA,NA,NA,NA,NA,NA,NA,NA,NA,NA,NA,NA,NA,NA,"","",""
"2","are married women required by law to obey their husbands?-WBL-1 Yes 0 No","115-WBL-Total","Are married women required by law to obey their husbands?","Total","Are married women required by law to obey their husbands?","WBL",NA,NA,NA,NA,NA,NA,NA,NA,NA,NA,NA,NA,NA,NA,NA,NA,NA,NA,NA,NA,NA,NA,"","",""
"3","are mothers guaranteed an equivalent position after maternity leave?-WBL-1 Yes 0 No","94-WBL-Total","Are mothers guaranteed an equivalent position after maternity leave?","Total","Are mothers guaranteed an equivalent position after maternity leave?","WBL",NA,NA,NA,NA,NA,NA,NA,NA,NA,NA,NA,NA,NA,NA,NA,NA,NA,NA,NA,NA,NA,NA,"","",""
"4","are payments for childcare tax deductible?-WBL-1 Yes 0 No","89-WBL-Total","Are payments for childcare tax deductible?","Total","Are payments for childcare tax deductible?","WBL",NA,NA,NA,NA,NA,NA,NA,NA,NA,NA,NA,NA,NA,NA,NA,NA,NA,NA,NA,NA,NA,NA,"","",""
"5","are there any exceptions to the legal age of marriage?-WBL-1 Yes 0 No","11-WBL-Total","Are there any exceptions to the legal age of marriage?","Total","Are there any exceptions to the legal age of marriage?","WBL",NA,NA,NA,NA,NA,NA,NA,NA,NA,NA,NA,NA,NA,NA,NA,NA,NA,NA,NA,NA,NA,NA,"","",""
"6","are there civil remedies for sexual harassment in employment?-WBL-1 Yes 0 No","17-WBL-Total","Are there civil remedies for sexual harassment in employment?","Total","Are there civil remedies for sexual harassment in employment?","WBL",NA,NA,NA,NA,NA,NA,NA,NA,NA,NA,NA,NA,NA,NA,NA,NA,NA,NA,NA,NA,NA,NA,"","",""
"7","are there clear criminal penalties for domestic violence?-WBL-1 Yes 0 No","29-WBL-Total","Are there clear criminal penalties for domestic violence?","Total","Are there clear criminal penalties for domestic violence?","WBL",NA,NA,NA,NA,NA,NA,NA,NA,NA,NA,NA,NA,NA,NA,NA,NA,NA,NA,NA,NA,NA,NA,"","",""
"8","are there criminal penalties for sexual harassment in employment?-WBL-1 Yes 0 No","16-WBL-Total","Are there criminal penalties for sexual harassment in employment?","Total","Are there criminal penalties for sexual harassment in employment?","WBL",NA,NA,NA,NA,NA,NA,NA,NA,NA,NA,NA,NA,NA,NA,NA,NA,NA,NA,NA,NA,NA,NA,"","",""
"9","are there dedicated and specialized family courts?-WBL-1 Yes 0 No","96-WBL-Total","Are there dedicated and specialized family courts?","Total","Are there dedicated and specialized family courts?","WBL",NA,NA,NA,NA,NA,NA,NA,NA,NA,NA,NA,NA,NA,NA,NA,NA,NA,NA,NA,NA,NA,NA,"","",""
"10","are there incentives eg financial for political parties to include women on candidate lists for municipal council elections?-WBL-1 Yes 0 No","139-WBL-Total","Are there incentives (e.g. financial) for political parties to include women on candidate lists for municipal council elections? ","Total","Are there incentives eg financial for political parties to include women on candidate lists for municipal council elections?","WBL",NA,NA,NA,NA,NA,NA,NA,NA,NA,NA,NA,NA,NA,NA,NA,NA,NA,NA,NA,NA,NA,NA,"","",""
"11","are there incentives eg financial for political parties to include women on candidate lists for national parliament elections?-WBL-1 Yes 0 No","140-WBL-Total","Are there incentives (e.g. financial) for political parties to include women on candidate lists for national parliament elections? ","Total","Are there incentives eg financial for political parties to include women on candidate lists for national parliament elections?","WBL",NA,NA,NA,NA,NA,NA,NA,NA,NA,NA,NA,NA,NA,NA,NA,NA,NA,NA,NA,NA,NA,NA,"","",""
"12","are there incentives eg financial to include women on corporate boards?-WBL-1 Yes 0 No","141-WBL-Total","Are there incentives (e.g. financial) to include women on corporate boards?","Total","Are there incentives eg financial to include women on corporate boards?","WBL",NA,NA,NA,NA,NA,NA,NA,NA,NA,NA,NA,NA,NA,NA,NA,NA,NA,NA,NA,NA,NA,NA,"","",""
"13","are there penalties in the law for authorizing or knowingly entering into child or early marriage?-WBL-1 Yes 0 No","5-WBL-Total","Are there penalties in the law for authorizing or knowingly entering into child or early marriage? ","Total","Are there penalties in the law for authorizing or knowingly entering into child or early marriage?","WBL",NA,NA,NA,NA,NA,NA,NA,NA,NA,NA,NA,NA,NA,NA,NA,NA,NA,NA,NA,NA,NA,NA,"","",""
"14","are there sanctions for noncompliance with mandated quotas for women on candidate lists for municipal council elections?-WBL-1 Yes 0 No","142-WBL-Total","Are there sanctions for noncompliance with mandated quotas for women on candidate lists for municipal council elections?","Total","Are there sanctions for noncompliance with mandated quotas for women on candidate lists for municipal council elections?","WBL",NA,NA,NA,NA,NA,NA,NA,NA,NA,NA,NA,NA,NA,NA,NA,NA,NA,NA,NA,NA,NA,NA,"","",""
"15","are there sanctions for noncompliance with mandated quotas for women on candidate lists for national parliament elections?-WBL-1 Yes 0 No","143-WBL-Total","Are there sanctions for noncompliance with mandated quotas for women on candidate lists for national parliament elections? ","Total","Are there sanctions for noncompliance with mandated quotas for women on candidate lists for national parliament elections?","WBL",NA,NA,NA,NA,NA,NA,NA,NA,NA,NA,NA,NA,NA,NA,NA,NA,NA,NA,NA,NA,NA,NA,"","",""
"16","are there sanctions for noncompliance with mandated quotas for women on corporate boards?-WBL-1 Yes 0 No","144-WBL-Total","Are there sanctions for noncompliance with mandated quotas for women on corporate boards?","Total","Are there sanctions for noncompliance with mandated quotas for women on corporate boards?","WBL",NA,NA,NA,NA,NA,NA,NA,NA,NA,NA,NA,NA,NA,NA,NA,NA,NA,NA,NA,NA,NA,NA,"","",""
"17","are there special provisions for major transactions concerning the marital home?-WBL-1 Yes 0 No","112-WBL-Total","Are there special provisions for major transactions concerning the marital home?","Total","Are there special provisions for major transactions concerning the marital home?","WBL",NA,NA,NA,NA,NA,NA,NA,NA,NA,NA,NA,NA,NA,NA,NA,NA,NA,NA,NA,NA,NA,NA,"","",""
"18","are there specific tax deductions or tax credits that are only applicable to men?-WBL-1 Yes 0 No","91-WBL-Total","Are there specific tax deductions or tax credits that are only applicable to men?","Total","Are there specific tax deductions or tax credits that are only applicable to men?","WBL",NA,NA,NA,NA,NA,NA,NA,NA,NA,NA,NA,NA,NA,NA,NA,NA,NA,NA,NA,NA,NA,NA,"","",""
"19","are there tax deductions or tax credits specific to women?-WBL-1 Yes 0 No","90-WBL-Total","Are there tax deductions or tax credits specific to women?","Total","Are there tax deductions or tax credits specific to women?","WBL",NA,NA,NA,NA,NA,NA,NA,NA,NA,NA,NA,NA,NA,NA,NA,NA,NA,NA,NA,NA,NA,NA,"","",""
"20","can a married woman apply for a passport in the same way as a married man?-WBL-1 Yes 0 No","137-WBL-Total","Can a married woman apply for a passport in the same way as a married man?","Total","Can a married woman apply for a passport in the same way as a married man?","WBL",NA,NA,NA,NA,NA,NA,NA,NA,NA,NA,NA,NA,NA,NA,NA,NA,NA,NA,NA,NA,NA,NA,"","",""
"21","can a married woman be head of household or head of family in the same way as a married man?-WBL-1 Yes 0 No","117-WBL-Total","Can a married woman be -head of household- or -head of family- in the same way as a married man?","Total","Can a married woman be head of household or head of family in the same way as a married man?","WBL",NA,NA,NA,NA,NA,NA,NA,NA,NA,NA,NA,NA,NA,NA,NA,NA,NA,NA,NA,NA,NA,NA,"","",""
"22","can a married woman choose where to live in the same way as a married man?-WBL-1 Yes 0 No","121-WBL-Total","Can a married woman choose where to live in the same way as a married man?","Total","Can a married woman choose where to live in the same way as a married man?","WBL",NA,NA,NA,NA,NA,NA,NA,NA,NA,NA,NA,NA,NA,NA,NA,NA,NA,NA,NA,NA,NA,NA,"","",""
"23","can a married woman confer citizenship to a nonnational spouse in the same way as a man?-WBL-1 Yes 0 No","116-WBL-Total","Can a married woman confer citizenship to a non-national spouse in the same way as a man?","Total","Can a married woman confer citizenship to a nonnational spouse in the same way as a man?","WBL",NA,NA,NA,NA,NA,NA,NA,NA,NA,NA,NA,NA,NA,NA,NA,NA,NA,NA,NA,NA,NA,NA,"","",""
"24","can a married woman confer citizenship to her children in the same way as a married man?-WBL-1 Yes 0 No","119-WBL-Total","Can a married woman confer citizenship to her children in the same way as a married man?","Total","Can a married woman confer citizenship to her children in the same way as a married man?","WBL",NA,NA,NA,NA,NA,NA,NA,NA,NA,NA,NA,NA,NA,NA,NA,NA,NA,NA,NA,NA,NA,NA,"","",""
"25","can a married woman get a job or pursue a trade or profession in the same way as a married man?-WBL-1 Yes 0 No","129-WBL-Total","Can a married woman get a job or pursue a trade or profession in the same way as a married man?","Total","Can a married woman get a job or pursue a trade or profession in the same way as a married man?","WBL",NA,NA,NA,NA,NA,NA,NA,NA,NA,NA,NA,NA,NA,NA,NA,NA,NA,NA,NA,NA,NA,NA,"","",""
"26","can a married woman obtain a national id card in the same way as a married man?-WBL-1 Yes 0 No","135-WBL-Total","Can a married woman obtain a national ID card in the same way as a married man?","Total","Can a married woman obtain a national ID card in the same way as a married man?","WBL",NA,NA,NA,NA,NA,NA,NA,NA,NA,NA,NA,NA,NA,NA,NA,NA,NA,NA,NA,NA,NA,NA,"","",""
"27","can a married woman open a bank account in the same way as a married man?-WBL-1 Yes 0 No","123-WBL-Total","Can a married woman open a bank account in the same way as a married man?","Total","Can a married woman open a bank account in the same way as a married man?","WBL",NA,NA,NA,NA,NA,NA,NA,NA,NA,NA,NA,NA,NA,NA,NA,NA,NA,NA,NA,NA,NA,NA,"","",""
"28","can a married woman register a business in the same way as a married man?-WBL-1 Yes 0 No","125-WBL-Total","Can a married woman register a business in the same way as a married man?","Total","Can a married woman register a business in the same way as a married man?","WBL",NA,NA,NA,NA,NA,NA,NA,NA,NA,NA,NA,NA,NA,NA,NA,NA,NA,NA,NA,NA,NA,NA,"","",""
"29","can a married woman sign a contract in the same way as a married man?-WBL-1 Yes 0 No","127-WBL-Total","Can a married woman sign a contract in the same way as a married man?","Total","Can a married woman sign a contract in the same way as a married man?","WBL",NA,NA,NA,NA,NA,NA,NA,NA,NA,NA,NA,NA,NA,NA,NA,NA,NA,NA,NA,NA,NA,NA,"","",""
"30","can a married woman travel outside her home in the same way as a married man?-WBL-1 Yes 0 No","131-WBL-Total","Can a married woman travel outside her home in the same way as a married man?","Total","Can a married woman travel outside her home in the same way as a married man?","WBL",NA,NA,NA,NA,NA,NA,NA,NA,NA,NA,NA,NA,NA,NA,NA,NA,NA,NA,NA,NA,NA,NA,"","",""
"31","can a married woman travel outside the country in the same way as a married man?-WBL-1 Yes 0 No","133-WBL-Total","Can a married woman travel outside the country in the same way as a married man?","Total","Can a married woman travel outside the country in the same way as a married man?","WBL",NA,NA,NA,NA,NA,NA,NA,NA,NA,NA,NA,NA,NA,NA,NA,NA,NA,NA,NA,NA,NA,NA,"","",""
"32","can an unmarried woman apply for a passport in the same way as an unmarried man?-WBL-1 Yes 0 No","138-WBL-Total","Can an unmarried woman apply for a passport in the same way as an unmarried man?","Total","Can an unmarried woman apply for a passport in the same way as an unmarried man?","WBL",NA,NA,NA,NA,NA,NA,NA,NA,NA,NA,NA,NA,NA,NA,NA,NA,NA,NA,NA,NA,NA,NA,"","",""
"33","can an unmarried woman be head of household or head of family in the same way as an unmarried man?-WBL-1 Yes 0 No","118-WBL-Total","Can an unmarried woman be -head of household- or -head of family- in the same way as an unmarried man?","Total","Can an unmarried woman be head of household or head of family in the same way as an unmarried man?","WBL",NA,NA,NA,NA,NA,NA,NA,NA,NA,NA,NA,NA,NA,NA,NA,NA,NA,NA,NA,NA,NA,NA,"","",""
"34","can an unmarried woman choose where to live in the same way as an unmarried man?-WBL-1 Yes 0 No","122-WBL-Total","Can an unmarried woman choose where to live in the same way as an unmarried man?","Total","Can an unmarried woman choose where to live in the same way as an unmarried man?","WBL",NA,NA,NA,NA,NA,NA,NA,NA,NA,NA,NA,NA,NA,NA,NA,NA,NA,NA,NA,NA,NA,NA,"","",""
"35","can an unmarried woman confer citizenship to her children in the same way as an unmarried man?-WBL-1 Yes 0 No","120-WBL-Total","Can an unmarried woman confer citizenship to her children in the same way as an unmarried man?","Total","Can an unmarried woman confer citizenship to her children in the same way as an unmarried man?","WBL",NA,NA,NA,NA,NA,NA,NA,NA,NA,NA,NA,NA,NA,NA,NA,NA,NA,NA,NA,NA,NA,NA,"","",""
"36","can an unmarried woman get a job or pursue a trade or profession in the same way as an unmarried man?-WBL-1 Yes 0 No","130-WBL-Total","Can an unmarried woman get a job or pursue a trade or profession in the same way as an unmarried man?","Total","Can an unmarried woman get a job or pursue a trade or profession in the same way as an unmarried man?","WBL",NA,NA,NA,NA,NA,NA,NA,NA,NA,NA,NA,NA,NA,NA,NA,NA,NA,NA,NA,NA,NA,NA,"","",""
"37","can an unmarried woman obtain a national id card in the same way as an unmarried man?-WBL-1 Yes 0 No","136-WBL-Total","Can an unmarried woman obtain a national ID card in the same way as an unmarried man?","Total","Can an unmarried woman obtain a national ID card in the same way as an unmarried man?","WBL",NA,NA,NA,NA,NA,NA,NA,NA,NA,NA,NA,NA,NA,NA,NA,NA,NA,NA,NA,NA,NA,NA,"","",""
"38","can an unmarried woman open a bank account in the same way as an unmarried man?-WBL-1 Yes 0 No","124-WBL-Total","Can an unmarried woman open a bank account in the same way as an unmarried man?","Total","Can an unmarried woman open a bank account in the same way as an unmarried man?","WBL",NA,NA,NA,NA,NA,NA,NA,NA,NA,NA,NA,NA,NA,NA,NA,NA,NA,NA,NA,NA,NA,NA,"","",""
"39","can an unmarried woman register a business in the same way as an unmarried man?-WBL-1 Yes 0 No","126-WBL-Total","Can an unmarried woman register a business in the same way as an unmarried man?","Total","Can an unmarried woman register a business in the same way as an unmarried man?","WBL",NA,NA,NA,NA,NA,NA,NA,NA,NA,NA,NA,NA,NA,NA,NA,NA,NA,NA,NA,NA,NA,NA,"","",""
"40","can an unmarried woman sign a contract in the same way as an unmarried man?-WBL-1 Yes 0 No","128-WBL-Total","Can an unmarried woman sign a contract in the same way as an unmarried man?","Total","Can an unmarried woman sign a contract in the same way as an unmarried man?","WBL",NA,NA,NA,NA,NA,NA,NA,NA,NA,NA,NA,NA,NA,NA,NA,NA,NA,NA,NA,NA,NA,NA,"","",""
"41","can an unmarried woman travel outside her home in the same way as an unmarried man?-WBL-1 Yes 0 No","132-WBL-Total","Can an unmarried woman travel outside her home in the same way as an unmarried man?","Total","Can an unmarried woman travel outside her home in the same way as an unmarried man?","WBL",NA,NA,NA,NA,NA,NA,NA,NA,NA,NA,NA,NA,NA,NA,NA,NA,NA,NA,NA,NA,NA,NA,"","",""
"42","can an unmarried woman travel outside the country in the same way as an unmarried man?-WBL-1 Yes 0 No","134-WBL-Total","Can an unmarried woman travel outside the country in the same way as an unmarried man?","Total","Can an unmarried woman travel outside the country in the same way as an unmarried man?","WBL",NA,NA,NA,NA,NA,NA,NA,NA,NA,NA,NA,NA,NA,NA,NA,NA,NA,NA,NA,NA,NA,NA,"","",""
"43","can nonpregnant and nonnursing women do the same jobs as men?-WBL-1 Yes 0 No","45-WBL-Total","Can nonpregnant and nonnursing women do the same jobs as men?","Total","Can nonpregnant and nonnursing women do the same jobs as men?","WBL",NA,NA,NA,NA,NA,NA,NA,NA,NA,NA,NA,NA,NA,NA,NA,NA,NA,NA,NA,NA,NA,NA,"","",""
"44","can nonpregnant and nonnursing women engage in jobs requiring lifting weights above a threshold in the same way as men?-WBL-1 Yes 0 No","33-WBL-Total","Can nonpregnant and nonnursing women engage in jobs requiring lifting weights above a threshold in the same way as men?","Total","Can nonpregnant and nonnursing women engage in jobs requiring lifting weights above a threshold in the same way as men?","WBL",NA,NA,NA,NA,NA,NA,NA,NA,NA,NA,NA,NA,NA,NA,NA,NA,NA,NA,NA,NA,NA,NA,"","",""
"45","can nonpregnant and nonnursing women work in agriculture in the same way as men?-WBL-1 Yes 0 No","38-WBL-Total","Can nonpregnant and nonnursing women work in agriculture in the same way as men?","Total","Can nonpregnant and nonnursing women work in agriculture in the same way as men?","WBL",NA,NA,NA,NA,NA,NA,NA,NA,NA,NA,NA,NA,NA,NA,NA,NA,NA,NA,NA,NA,NA,NA,"","",""
"46","can nonpregnant and nonnursing women work in all other jobs in the same way as men?-WBL-1 Yes 0 No","32-WBL-Total","Can nonpregnant and nonnursing women work in all other jobs in the same way as men?","Total","Can nonpregnant and nonnursing women work in all other jobs in the same way as men?","WBL",NA,NA,NA,NA,NA,NA,NA,NA,NA,NA,NA,NA,NA,NA,NA,NA,NA,NA,NA,NA,NA,NA,"","",""
"47","can nonpregnant and nonnursing women work in construction in the same way as men?-WBL-1 Yes 0 No","39-WBL-Total","Can nonpregnant and nonnursing women work in construction in the same way as men?","Total","Can nonpregnant and nonnursing women work in construction in the same way as men?","WBL",NA,NA,NA,NA,NA,NA,NA,NA,NA,NA,NA,NA,NA,NA,NA,NA,NA,NA,NA,NA,NA,NA,"","",""
"48","can nonpregnant and nonnursing women work in energy sector in the same way as men?-WBL-1 Yes 0 No","36-WBL-Total","Can nonpregnant and nonnursing women work in energy sector in the same way as men?","Total","Can nonpregnant and nonnursing women work in energy sector in the same way as men?","WBL",NA,NA,NA,NA,NA,NA,NA,NA,NA,NA,NA,NA,NA,NA,NA,NA,NA,NA,NA,NA,NA,NA,"","",""
"49","can nonpregnant and nonnursing women work in factories in the same way as men?-WBL-1 Yes 0 No","40-WBL-Total","Can nonpregnant and nonnursing women work in factories in the same way as men?","Total","Can nonpregnant and nonnursing women work in factories in the same way as men?","WBL",NA,NA,NA,NA,NA,NA,NA,NA,NA,NA,NA,NA,NA,NA,NA,NA,NA,NA,NA,NA,NA,NA,"","",""
"50","can nonpregnant and nonnursing women work in jobs deemed arduous in the same way as men?-WBL-1 Yes 0 No","42-WBL-Total","Can nonpregnant and nonnursing women work in jobs deemed arduous in the same way as men?","Total","Can nonpregnant and nonnursing women work in jobs deemed arduous in the same way as men?","WBL",NA,NA,NA,NA,NA,NA,NA,NA,NA,NA,NA,NA,NA,NA,NA,NA,NA,NA,NA,NA,NA,NA,"","",""
"51","can nonpregnant and nonnursing women work in jobs deemed hazardous in the same way as men?-WBL-1 Yes 0 No","44-WBL-Total","Can nonpregnant and nonnursing women work in jobs deemed hazardous in the same way as men?","Total","Can nonpregnant and nonnursing women work in jobs deemed hazardous in the same way as men?","WBL",NA,NA,NA,NA,NA,NA,NA,NA,NA,NA,NA,NA,NA,NA,NA,NA,NA,NA,NA,NA,NA,NA,"","",""
"52","can nonpregnant and nonnursing women work in jobs deemed morally or socially inappropriate in the same way as men?-WBL-1 Yes 0 No","43-WBL-Total","Can nonpregnant and nonnursing women work in jobs deemed morally or socially inappropriate in the same way as men?","Total","Can nonpregnant and nonnursing women work in jobs deemed morally or socially inappropriate in the same way as men?","WBL",NA,NA,NA,NA,NA,NA,NA,NA,NA,NA,NA,NA,NA,NA,NA,NA,NA,NA,NA,NA,NA,NA,"","",""
"53","can nonpregnant and nonnursing women work in metalworking in the same way as men?-WBL-1 Yes 0 No","34-WBL-Total","Can nonpregnant and nonnursing women work in metalworking in the same way as men?","Total","Can nonpregnant and nonnursing women work in metalworking in the same way as men?","WBL",NA,NA,NA,NA,NA,NA,NA,NA,NA,NA,NA,NA,NA,NA,NA,NA,NA,NA,NA,NA,NA,NA,"","",""
"54","can nonpregnant and nonnursing women work in mining in the same way as men?-WBL-1 Yes 0 No","41-WBL-Total","Can nonpregnant and nonnursing women work in mining in the same way as men?","Total","Can nonpregnant and nonnursing women work in mining in the same way as men?","WBL",NA,NA,NA,NA,NA,NA,NA,NA,NA,NA,NA,NA,NA,NA,NA,NA,NA,NA,NA,NA,NA,NA,"","",""
"55","can nonpregnant and nonnursing women work in transport in the same way as men?-WBL-1 Yes 0 No","35-WBL-Total","Can nonpregnant and nonnursing women work in transport in the same way as men?","Total","Can nonpregnant and nonnursing women work in transport in the same way as men?","WBL",NA,NA,NA,NA,NA,NA,NA,NA,NA,NA,NA,NA,NA,NA,NA,NA,NA,NA,NA,NA,NA,NA,"","",""
"56","can nonpregnant and nonnursing women work in water sector in the same way as men?-WBL-1 Yes 0 No","37-WBL-Total","Can nonpregnant and nonnursing women work in water sector in the same way as men?","Total","Can nonpregnant and nonnursing women work in water sector in the same way as men?","WBL",NA,NA,NA,NA,NA,NA,NA,NA,NA,NA,NA,NA,NA,NA,NA,NA,NA,NA,NA,NA,NA,NA,"","",""
"57","can nonpregnant and nonnursing women work the same night hours as men?-WBL-1 Yes 0 No","46-WBL-Total","Can nonpregnant and nonnursing women work the same night hours as men?","Total","Can nonpregnant and nonnursing women work the same night hours as men?","WBL",NA,NA,NA,NA,NA,NA,NA,NA,NA,NA,NA,NA,NA,NA,NA,NA,NA,NA,NA,NA,NA,NA,"","",""
"58","can parents work flexibly?-WBL-1 Yes 0 No","53-WBL-Total","Can parents work flexibly?","Total","Can parents work flexibly?","WBL",NA,NA,NA,NA,NA,NA,NA,NA,NA,NA,NA,NA,NA,NA,NA,NA,NA,NA,NA,NA,NA,NA,"","",""
"59","do female and male surviving spouses have equal rights to inherit assets?-WBL-1 Yes 0 No","107-WBL-Total","Do female and male surviving spouses have equal rights to inherit assets?","Total","Do female and male surviving spouses have equal rights to inherit assets?","WBL",NA,NA,NA,NA,NA,NA,NA,NA,NA,NA,NA,NA,NA,NA,NA,NA,NA,NA,NA,NA,NA,NA,"","",""
"60","do married couples jointly share legal responsibility for financially maintaining the familys expenses?-WBL-1 Yes 0 No","114-WBL-Total","Do married couples jointly share legal responsibility for financially maintaining the family's expenses?","Total","Do married couples jointly share legal responsibility for financially maintaining the familys expenses?","WBL",NA,NA,NA,NA,NA,NA,NA,NA,NA,NA,NA,NA,NA,NA,NA,NA,NA,NA,NA,NA,NA,NA,"","",""
"61","do married men and married women have equal ownership rights to property?-WBL-1 Yes 0 No","109-WBL-Total","Do married men and married women have equal ownership rights to property?","Total","Do married men and married women have equal ownership rights to property?","WBL",NA,NA,NA,NA,NA,NA,NA,NA,NA,NA,NA,NA,NA,NA,NA,NA,NA,NA,NA,NA,NA,NA,"","",""
"62","do microfinance institutions provide information to private credit bureaus or public credit registries?-WBL-1 Yes 0 No","83-WBL-Total","Do microfinance institutions provide information to private credit bureaus or public credit registries?","Total","Do microfinance institutions provide information to private credit bureaus or public credit registries?","WBL",NA,NA,NA,NA,NA,NA,NA,NA,NA,NA,NA,NA,NA,NA,NA,NA,NA,NA,NA,NA,NA,NA,"","",""
"63","do microfinance institutions provide negative information to private credit bureaus or public credit registries?-WBL-1 Yes 0 No","77-WBL-Total","Do microfinance institutions provide negative information to private credit bureaus or public credit registries? ","Total","Do microfinance institutions provide negative information to private credit bureaus or public credit registries?","WBL",NA,NA,NA,NA,NA,NA,NA,NA,NA,NA,NA,NA,NA,NA,NA,NA,NA,NA,NA,NA,NA,NA,"","",""
"64","do microfinance institutions provide positive information to private credit bureaus or public credit registries?-WBL-1 Yes 0 No","78-WBL-Total","Do microfinance institutions provide positive information to private credit bureaus or public credit registries? ","Total","Do microfinance institutions provide positive information to private credit bureaus or public credit registries?","WBL",NA,NA,NA,NA,NA,NA,NA,NA,NA,NA,NA,NA,NA,NA,NA,NA,NA,NA,NA,NA,NA,NA,"","",""
"65","do parents receive nontax benefits child allowance for children under 6 years?-WBL-1 Yes 0 No","88-WBL-Total","Do parents receive non-tax benefits (child allowance) for children under 6 years?","Total","Do parents receive nontax benefits child allowance for children under 6 years?","WBL",NA,NA,NA,NA,NA,NA,NA,NA,NA,NA,NA,NA,NA,NA,NA,NA,NA,NA,NA,NA,NA,NA,"","",""
"66","do private childcare centers receive nontax benefits?-WBL-1 Yes 0 No","93-WBL-Total","Do private childcare centers receive non-tax benefits? ","Total","Do private childcare centers receive nontax benefits?","WBL",NA,NA,NA,NA,NA,NA,NA,NA,NA,NA,NA,NA,NA,NA,NA,NA,NA,NA,NA,NA,NA,NA,"","",""
"67","do protection orders cover prohibition of contact and maintaining distance from the survivor?-WBL-1 Yes 0 No","20-WBL-Total","Do protection orders cover prohibition of contact and maintaining distance from the survivor?","Total","Do protection orders cover prohibition of contact and maintaining distance from the survivor?","WBL",NA,NA,NA,NA,NA,NA,NA,NA,NA,NA,NA,NA,NA,NA,NA,NA,NA,NA,NA,NA,NA,NA,"","",""
