"","Indicator","Indicator_Id","Indicator_Name","answer","Display_Name","Dataset","Value_Type_Slug","Value_Type_Descriptor","Units","Rank_1","Category_11","Category_12","Category_13","Category_14","Category_15","Rank_2","Category_21","Category_22","Category_23","Category_24","Category_25","Rank_3","Category_31","Category_32","Category_33","Category_34","Indicator.Code","Indicator.ID","overlap","Indicator_Code","Description"
"138","what is the age at which a man can retire and receive partial benefits?-WBL-1 Yes 0 No","50-WBL-Total","What is the age at which a man can retire and receive partial benefits?","Total","What is the age at which a man can retire and receive partial benefits?","WBL",NA,NA,NA,NA,NA,NA,NA,NA,NA,NA,NA,NA,NA,NA,NA,NA,NA,NA,NA,NA,NA,NA,"","",""
"139","what is the age at which a woman can retire and receive full benefits?-WBL-1 Yes 0 No","51-WBL-Total","What is the age at which a woman can retire and receive full benefits?","Total","What is the age at which a woman can retire and receive full benefits?","WBL",NA,NA,NA,NA,NA,NA,NA,NA,NA,NA,NA,NA,NA,NA,NA,NA,NA,NA,NA,NA,NA,NA,"","",""
"140","what is the age at which a woman can retire and receive partial benefits?-WBL-1 Yes 0 No","49-WBL-Total","What is the age at which a woman can retire and receive partial benefits?","Total","What is the age at which a woman can retire and receive partial benefits?","WBL",NA,NA,NA,NA,NA,NA,NA,NA,NA,NA,NA,NA,NA,NA,NA,NA,NA,NA,NA,NA,NA,NA,"","",""
"141","what is the legal age of marriage for boys?-WBL-1 Yes 0 No","13-WBL-Total","What is the legal age of marriage for boys?","Total","What is the legal age of marriage for boys?","WBL",NA,NA,NA,NA,NA,NA,NA,NA,NA,NA,NA,NA,NA,NA,NA,NA,NA,NA,NA,NA,NA,NA,"","",""
"142","what is the legal age of marriage for girls?-WBL-1 Yes 0 No","12-WBL-Total","What is the legal age of marriage for girls?","Total","What is the legal age of marriage for girls?","WBL",NA,NA,NA,NA,NA,NA,NA,NA,NA,NA,NA,NA,NA,NA,NA,NA,NA,NA,NA,NA,NA,NA,"","",""
"143","what is the length of paid maternity leave?-WBL-1 Yes 0 No","71-WBL-Total","What is the length of paid maternity leave?","Total","What is the length of paid maternity leave?","WBL",NA,NA,NA,NA,NA,NA,NA,NA,NA,NA,NA,NA,NA,NA,NA,NA,NA,NA,NA,NA,NA,NA,"","",""
"144","what is the length of paid parental leave?-WBL-1 Yes 0 No","69-WBL-Total","What is the length of paid parental leave?","Total","What is the length of paid parental leave?","WBL",NA,NA,NA,NA,NA,NA,NA,NA,NA,NA,NA,NA,NA,NA,NA,NA,NA,NA,NA,NA,NA,NA,"","",""
"145","what is the length of paid paternity leave?-WBL-1 Yes 0 No","70-WBL-Total","What is the length of paid paternity leave?","Total","What is the length of paid paternity leave?","WBL",NA,NA,NA,NA,NA,NA,NA,NA,NA,NA,NA,NA,NA,NA,NA,NA,NA,NA,NA,NA,NA,NA,"","",""
"146","what is the length of unpaid maternity leave?-WBL-1 Yes 0 No","68-WBL-Total","What is the length of unpaid maternity leave?","Total","What is the length of unpaid maternity leave?","WBL",NA,NA,NA,NA,NA,NA,NA,NA,NA,NA,NA,NA,NA,NA,NA,NA,NA,NA,NA,NA,NA,NA,"","",""
"147","what is the length of unpaid parental leave?-WBL-1 Yes 0 No","66-WBL-Total","What is the length of unpaid parental leave?","Total","What is the length of unpaid parental leave?","WBL",NA,NA,NA,NA,NA,NA,NA,NA,NA,NA,NA,NA,NA,NA,NA,NA,NA,NA,NA,NA,NA,NA,"","",""
"148","what is the length of unpaid paternity leave?-WBL-1 Yes 0 No","67-WBL-Total","What is the length of unpaid paternity leave?","Total","What is the length of unpaid paternity leave?","WBL",NA,NA,NA,NA,NA,NA,NA,NA,NA,NA,NA,NA,NA,NA,NA,NA,NA,NA,NA,NA,NA,NA,"","",""
"149","what is the mandatory retirement age for men?-WBL-1 Yes 0 No","48-WBL-Total","What is the mandatory retirement age for men?","Total","What is the mandatory retirement age for men?","WBL","1 Yes 0 No","1 Yes 0 No","Index",4.152,"Private Sector Interface","Property rights and contracts","Other","What is the mandatory retirement age for men?","",4.268,"Private Sector Interface","Permits and Licenses","Other","What is the mandatory retirement age for men?","",4.177,"Private Sector Interface","Regulation of entry and exit","Other","What is the mandatory retirement age for men?","WBL133","32640","","",""
"150","what is the mandatory retirement age for women?-WBL-1 Yes 0 No","47-WBL-Total","What is the mandatory retirement age for women?","Total","What is the mandatory retirement age for women?","WBL","1 Yes 0 No","1 Yes 0 No","Index",4.469,"Private Sector Interface","Property rights and contracts","Other","What is the mandatory retirement age for women?","",4.284,"Private Sector Interface","Permits and Licenses","Other","What is the mandatory retirement age for women?","",4.106,"Private Sector Interface","Regulation of entry and exit","Other","What is the mandatory retirement age for women?","WBL134","32641","","",""
"151","what is the minimum age of marriage with judicial authorization for boys?-WBL-1 Yes 0 No","8-WBL-Total","What is the minimum age of marriage with judicial authorization for boys?","Total","What is the minimum age of marriage with judicial authorization for boys?","WBL",NA,NA,NA,NA,NA,NA,NA,NA,NA,NA,NA,NA,NA,NA,NA,NA,NA,NA,NA,NA,NA,NA,"","",""
"152","what is the minimum age of marriage with judicial authorization for girls?-WBL-1 Yes 0 No","7-WBL-Total","What is the minimum age of marriage with judicial authorization for girls?","Total","What is the minimum age of marriage with judicial authorization for girls?","WBL",NA,NA,NA,NA,NA,NA,NA,NA,NA,NA,NA,NA,NA,NA,NA,NA,NA,NA,NA,NA,NA,NA,"","",""
"153","what is the minimum age of marriage with parental consent for boys?-WBL-1 Yes 0 No","10-WBL-Total","What is the minimum age of marriage with parental consent for boys?","Total","What is the minimum age of marriage with parental consent for boys?","WBL",NA,NA,NA,NA,NA,NA,NA,NA,NA,NA,NA,NA,NA,NA,NA,NA,NA,NA,NA,NA,NA,NA,"","",""
"154","what is the minimum age of marriage with parental consent for girls?-WBL-1 Yes 0 No","9-WBL-Total","What is the minimum age of marriage with parental consent for girls?","Total","What is the minimum age of marriage with parental consent for girls?","WBL",NA,NA,NA,NA,NA,NA,NA,NA,NA,NA,NA,NA,NA,NA,NA,NA,NA,NA,NA,NA,NA,NA,"","",""
"155","what is the minimum loan amount covered in the private credit bureau or public credit registry?-WBL-1 Yes 0 No","152-WBL-Total","What is the minimum loan amount covered in the private credit bureau or public credit registry?","Total","What is the minimum loan amount covered in the private credit bureau or public credit registry?","WBL","1 Yes 0 No","1 Yes 0 No","Index",4.449,"Private Sector Interface","Property rights and contracts","Other","What is the minimum loan amount covered in the private credit bureau or public credit registry?","",4.294,"Private Sector Interface","Permits and Licenses","Other","What is the minimum loan amount covered in the private credit bureau or public credit registry?","",4.277,"Private Sector Interface","Regulation of entry and exit","Other","What is the minimum loan amount covered in the private credit bureau or public credit registry?","WBL135","32642","","",""
"156","what percentage of wages is paid during maternity leave?-WBL-1 Yes 0 No","156-WBL-Total","What percentage of wages is paid during maternity leave?","Total","What percentage of wages is paid during maternity leave?","WBL","1 Yes 0 No","1 Yes 0 No","Index",4.145,"Private Sector Interface","Property rights and contracts","Other","What percentage of wages is paid during maternity leave?","",4.072,"Private Sector Interface","Permits and Licenses","Other","What percentage of wages is paid during maternity leave?","",4.08,"Private Sector Interface","Regulation of entry and exit","Other","What percentage of wages is paid during maternity leave?","WBL136","32643","","",""
